{
  "header": {
    "artifactId": "PROJECTONE-SOURCE-REGISTRY",
    "version": "1.0",
    "status": "FROZEN",
    "schemaVersion": "1.0",
    "layer": "PROFILE",
    "governedBy": [
      "PAF-SPEC",
      "PAF-BINDING-MODEL"
    ],
    "createdAt": "2026-08-13T10:01:00-04:00",
    "frozenAt": "2026-08-13T15:26:10-04:00",
    "frozenUnder": "APR-002 (Step 54 owner approval)"
  },
  "tierModel": {
    "tiers": [
      {
        "tier": 1,
        "sourceClass": "ACTIVE_GOVERNANCE",
        "governs": "policy, agent authority, registries, overlays",
        "treatment": "Effective canon = immutable source + approved overlays"
      },
      {
        "tier": 2,
        "sourceClass": "NORMATIVE_IMMUTABLE",
        "governs": "product/design sources",
        "treatment": "Read with applicable overlays; never edited in place"
      },
      {
        "tier": 3,
        "sourceClass": "EVIDENCE_ONLY",
        "governs": "derivative/historical/spike",
        "treatment": "Informs, never determines"
      }
    ],
    "scopeRule": "Precedence is evaluated per subject. DDR wins on design conflicts; Build Policy is the sole home for VSA/CPM/UX and the 330 requirements; Roadmap governs sequence only."
  },
  "useClassifications": [
    {
      "classification": "ACTIVE_GOVERNANCE",
      "meaning": "Current governance authority",
      "mayDetermineResult": true
    },
    {
      "classification": "NORMATIVE_IMMUTABLE",
      "meaning": "Immutable product/design source",
      "mayDetermineResult": true
    },
    {
      "classification": "EVIDENCE_ONLY",
      "meaning": "Evidence: prototype, spike, historical, illustrative",
      "mayDetermineResult": false
    }
  ],
  "resolutionRules": {
    "scopeBound": "Precedence is evaluated per subject. A source does not control subjects outside its declared scope.",
    "recencyIsNotAuthority": "A newer artifact never supersedes an older one by virtue of being newer. Supersession is explicit, recorded, and approved.",
    "overlayRule": "Effective source = immutable source + all applicable approved overlay entries. Reading the base source alone is an incomplete read.",
    "conflictBehavior": "STOP_AND_ESCALATE",
    "unboundBehavior": "MOST_RESTRICTIVE_PLUS_WARNING"
  },
  "immutabilityModel": {
    "immutableClassRule": "Immutable uploaded ProjectOne sources are never edited in place.",
    "correctionMechanism": "999 overlay entry only.",
    "directMaintenanceRule": "Assistant-created artifacts (Policy, S&R, registries, Profile, schemas, contracts) are maintained directly and must NOT be routed through the 999 overlay."
  },
  "sources": [
    {
      "sourceId": "101",
      "displayName": "101-ProjectOne-Platform-Orientation.md",
      "tier": 2,
      "version": "as-packaged",
      "versionResolved": true,
      "status": "ACTIVE",
      "immutable": true,
      "contentHash": "0b9d7ab7b78f071b608c836c01a3df359f002afbdc0da0e4da8d1216df9a8d0c",
      "governsSubjects": [
        "product/design source"
      ],
      "useClassification": "NORMATIVE_IMMUTABLE",
      "overlayRefs": [],
      "availability": "PRESENT"
    },
    {
      "sourceId": "104",
      "displayName": "104-Delphics-Business-Model-and-GTM.md",
      "tier": 2,
      "version": "as-packaged",
      "versionResolved": true,
      "status": "ACTIVE",
      "immutable": true,
      "contentHash": "62dcec3add89247990d109fd540af4320466583079d4069cab697d9675c93b0b",
      "governsSubjects": [
        "product/design source"
      ],
      "useClassification": "NORMATIVE_IMMUTABLE",
      "overlayRefs": [],
      "availability": "PRESENT"
    },
    {
      "sourceId": "201",
      "displayName": "201-ProjectOne-Design-Decision-Record.md",
      "tier": 2,
      "version": "as-packaged",
      "versionResolved": true,
      "status": "ACTIVE",
      "immutable": true,
      "contentHash": "46c7036aa83aae6999bbd692a1648e91f79fd2e5574bb38e8717eac72cfa5ece",
      "governsSubjects": [
        "product/design source"
      ],
      "useClassification": "NORMATIVE_IMMUTABLE",
      "overlayRefs": [],
      "availability": "PRESENT"
    },
    {
      "sourceId": "202",
      "displayName": "202-ProjectOne-Chart-Spec-Convention.md",
      "tier": 2,
      "version": "as-packaged",
      "versionResolved": true,
      "status": "ACTIVE",
      "immutable": true,
      "contentHash": "54a11b290a233736b6a76c74ccce04521177882d5bfadfd61444e709b7cc7963",
      "governsSubjects": [
        "product/design source"
      ],
      "useClassification": "NORMATIVE_IMMUTABLE",
      "overlayRefs": [],
      "availability": "PRESENT"
    },
    {
      "sourceId": "203",
      "displayName": "203-ProjectOne-Chart-Spec-Interval-Variance-Timeline.md",
      "tier": 2,
      "version": "as-packaged",
      "versionResolved": true,
      "status": "ACTIVE",
      "immutable": true,
      "contentHash": "69ac1247bd864a3e094d73f170548660bee6cc4da3128b5cb6378b49462e3e6f",
      "governsSubjects": [
        "product/design source"
      ],
      "useClassification": "NORMATIVE_IMMUTABLE",
      "overlayRefs": [],
      "availability": "PRESENT"
    },
    {
      "sourceId": "204",
      "displayName": "204-ProjectOne-Chart-Spec-Ranked-Path-Duration-Flow.md",
      "tier": 2,
      "version": "as-packaged",
      "versionResolved": true,
      "status": "ACTIVE",
      "immutable": true,
      "contentHash": "9955636d8a5444ce7489f407515874295ec7e35ad6f21f6c2cc2560a81211a02",
      "governsSubjects": [
        "product/design source"
      ],
      "useClassification": "NORMATIVE_IMMUTABLE",
      "overlayRefs": [],
      "availability": "PRESENT"
    },
    {
      "sourceId": "205",
      "displayName": "205-ProjectOne-Data-Dictionary.md",
      "tier": 2,
      "version": "as-packaged",
      "versionResolved": true,
      "status": "ACTIVE",
      "immutable": true,
      "contentHash": "45ba95ccb6d2c93d357b2870770fc555b418f5e1d313b32d9267c463605a6916",
      "governsSubjects": [
        "product/design source"
      ],
      "useClassification": "NORMATIVE_IMMUTABLE",
      "overlayRefs": [],
      "availability": "PRESENT"
    },
    {
      "sourceId": "301",
      "displayName": "301-Process_Mining_Methodology_Playbook.json",
      "tier": 2,
      "version": "as-packaged",
      "versionResolved": true,
      "status": "ACTIVE",
      "immutable": true,
      "contentHash": "8636f4715ac37b85d932fc7c9dcffa599e079c4d4cc8d98af0de1021589608d9",
      "governsSubjects": [
        "product/design source"
      ],
      "useClassification": "NORMATIVE_IMMUTABLE",
      "overlayRefs": [],
      "availability": "PRESENT"
    },
    {
      "sourceId": "401",
      "displayName": "401-ProjectOne-PRD.md",
      "tier": 2,
      "version": "as-packaged",
      "versionResolved": true,
      "status": "ACTIVE",
      "immutable": true,
      "contentHash": "bd802e4a36c37a73d2f84a7158a354facc6490cff70ad475fe62bdfcb63b1b87",
      "governsSubjects": [
        "product/design source"
      ],
      "useClassification": "NORMATIVE_IMMUTABLE",
      "overlayRefs": [],
      "availability": "PRESENT"
    },
    {
      "sourceId": "402",
      "displayName": "402-ProjectOne-PRD-Tracker.md",
      "tier": 2,
      "version": "as-packaged",
      "versionResolved": true,
      "status": "ACTIVE",
      "immutable": true,
      "contentHash": "37c91d54f873c103dd48f6eebce849d58406c5961219e66f9c8d6cff467b2a8d",
      "governsSubjects": [
        "product/design source"
      ],
      "useClassification": "NORMATIVE_IMMUTABLE",
      "overlayRefs": [],
      "availability": "PRESENT"
    },
    {
      "sourceId": "403",
      "displayName": "403-ProjectOne-Project-Manifest.md",
      "tier": 2,
      "version": "as-packaged",
      "versionResolved": true,
      "status": "ACTIVE",
      "immutable": true,
      "contentHash": "18d9945deff5323b2e86a7c6397cef7404f37169b806b7c611dca5ecd938e5c9",
      "governsSubjects": [
        "product/design source"
      ],
      "useClassification": "NORMATIVE_IMMUTABLE",
      "overlayRefs": [],
      "availability": "PRESENT"
    },
    {
      "sourceId": "404",
      "displayName": "404-ProjectOne-Continuity-Orientation-Brief.md",
      "tier": 2,
      "version": "as-packaged",
      "versionResolved": true,
      "status": "ACTIVE",
      "immutable": true,
      "contentHash": "774e523338419921648fc2f8af278676ee8af35f1c03a746273996d668e4c2f8",
      "governsSubjects": [
        "product/design source"
      ],
      "useClassification": "NORMATIVE_IMMUTABLE",
      "overlayRefs": [],
      "availability": "PRESENT"
    },
    {
      "sourceId": "405",
      "displayName": "405-ProjectOne-Spike-Kickoff-Brief.md",
      "tier": 2,
      "version": "as-packaged",
      "versionResolved": true,
      "status": "ACTIVE",
      "immutable": true,
      "contentHash": "a0e3d566ac94a09cc8ed21d50c66174338a7efa12dde90b5a4f00eba6682c62e",
      "governsSubjects": [
        "product/design source"
      ],
      "useClassification": "NORMATIVE_IMMUTABLE",
      "overlayRefs": [],
      "availability": "PRESENT"
    },
    {
      "sourceId": "409",
      "displayName": "409-ProjectOne-Build-Lessons-Learned.md",
      "tier": 2,
      "version": "as-packaged",
      "versionResolved": true,
      "status": "ACTIVE",
      "immutable": true,
      "contentHash": "afa7d0cf8009183903df511d51db1e124c527d27897ec28abfa25326b87b334e",
      "governsSubjects": [
        "product/design source"
      ],
      "useClassification": "NORMATIVE_IMMUTABLE",
      "overlayRefs": [],
      "availability": "PRESENT"
    },
    {
      "sourceId": "410",
      "displayName": "410-ProjectOne-Build-Roadmap.md",
      "tier": 2,
      "version": "as-packaged",
      "versionResolved": true,
      "status": "ACTIVE",
      "immutable": true,
      "contentHash": "2683dd887f65e19bbed9c259be85c1ef605fd864c293641ba5a20b648953046e",
      "governsSubjects": [
        "product/design source"
      ],